{
  "$schema": "./timezones.schema.json",
  "$note": "PIPELINE-RAW spec — produced by private/tools/geo-data-pipeline. Not directly consumed by codegen / DcsvIo.D2.Geo.Default. A clean/transform pass to the sibling contracts/geo/timezones.spec.json (one level up) is a separate step. Sources: IANA zone1970.tab + backward (public domain — canonical zones, primary/co-applicable country FKs, aliases, ISO 6709 coordinates) + Node's built-in ICU Intl.DateTimeFormat (current STD/DST offsets + abbreviations sampled at 2026-01-15 and 2026-07-15). Missing: LocalizedDisplayNames (CLDR cldr-dates-full/main/{locale}/timeZoneNames.json follow-up pass), Selectable (Tier 2 curated subset), Deprecation.",
  "catalogVersion": "0.0.1",
  "generatedAt": "2026-05-26T13:06:21.420Z",
  "sources": [
    {
      "name": "iana-tzdb",
      "url": "https://data.iana.org/time-zones/data/zone1970.tab",
      "license": "Public Domain (IANA Time Zone Database)",
      "fetchedAt": "2026-05-26T13:06:21.156Z",
      "sha256": "406555546e685b34eb46c24d826b649dd35e9d202f4c13a3c621ff21eddc1583"
    },
    {
      "name": "iana-tzdb",
      "url": "https://data.iana.org/time-zones/data/backward",
      "license": "Public Domain (IANA Time Zone Database)",
      "fetchedAt": "2026-05-26T13:06:21.058Z",
      "sha256": "d2f4c8953f204982ddf4dc0c2debf41b2464de376dad7d546d0fc70f889fa706"
    }
  ],
  "fieldCoverage": {
    "ianaIdentifier": {
      "populated": 312,
      "total": 312,
      "pct": "100.0%"
    },
    "displayName": {
      "populated": 312,
      "total": 312,
      "pct": "100.0%"
    },
    "currentStdOffsetMinutes": {
      "populated": 312,
      "total": 312,
      "pct": "100.0%"
    },
    "currentDstOffsetMinutes": {
      "populated": 105,
      "total": 312,
      "pct": "33.7%"
    },
    "currentStdAbbrev": {
      "populated": 312,
      "total": 312,
      "pct": "100.0%"
    },
    "currentDstAbbrev": {
      "populated": 105,
      "total": 312,
      "pct": "33.7%"
    },
    "countryISO31661Alpha2Code": {
      "populated": 312,
      "total": 312,
      "pct": "100.0%"
    },
    "aliases": {
      "populated": 109,
      "total": 312,
      "pct": "34.9%"
    },
    "coApplicableCountries": {
      "populated": 34,
      "total": 312,
      "pct": "10.9%"
    }
  },
  "reconciliation": {
    "ianaOnlyZones": [
      "America/Argentina/Buenos_Aires",
      "America/Argentina/Catamarca",
      "America/Argentina/Cordoba",
      "America/Argentina/Jujuy",
      "America/Argentina/Mendoza",
      "America/Indiana/Indianapolis",
      "America/Kentucky/Louisville",
      "America/Nuuk",
      "Asia/Ho_Chi_Minh",
      "Asia/Kathmandu",
      "Asia/Kolkata",
      "Asia/Yangon",
      "Atlantic/Faroe",
      "Europe/Kyiv",
      "Pacific/Kanton"
    ],
    "icuOnlyZones": [
      "Africa/Accra",
      "Africa/Addis_Ababa",
      "Africa/Asmera",
      "Africa/Bamako",
      "Africa/Bangui",
      "Africa/Banjul",
      "Africa/Blantyre",
      "Africa/Brazzaville",
      "Africa/Bujumbura",
      "Africa/Conakry",
      "Africa/Dakar",
      "Africa/Dar_es_Salaam",
      "Africa/Djibouti",
      "Africa/Douala",
      "Africa/Freetown",
      "Africa/Gaborone",
      "Africa/Harare",
      "Africa/Kampala",
      "Africa/Kigali",
      "Africa/Kinshasa",
      "Africa/Libreville",
      "Africa/Lome",
      "Africa/Luanda",
      "Africa/Lubumbashi",
      "Africa/Lusaka",
      "Africa/Malabo",
      "Africa/Maseru",
      "Africa/Mbabane",
      "Africa/Mogadishu",
      "Africa/Niamey",
      "Africa/Nouakchott",
      "Africa/Ouagadougou",
      "Africa/Porto-Novo",
      "America/Anguilla",
      "America/Antigua",
      "America/Aruba",
      "America/Blanc-Sablon",
      "America/Buenos_Aires",
      "America/Catamarca",
      "America/Cayman",
      "America/Coral_Harbour",
      "America/Cordoba",
      "America/Creston",
      "America/Curacao",
      "America/Dominica",
      "America/Godthab",
      "America/Grenada",
      "America/Guadeloupe",
      "America/Indianapolis",
      "America/Jujuy",
      "America/Kralendijk",
      "America/Louisville",
      "America/Lower_Princes",
      "America/Marigot",
      "America/Mendoza",
      "America/Montserrat",
      "America/Nassau",
      "America/Port_of_Spain",
      "America/St_Barthelemy",
      "America/St_Kitts",
      "America/St_Lucia",
      "America/St_Thomas",
      "America/St_Vincent",
      "America/Tortola",
      "Antarctica/DumontDUrville",
      "Antarctica/McMurdo",
      "Antarctica/Syowa",
      "Arctic/Longyearbyen",
      "Asia/Aden",
      "Asia/Bahrain",
      "Asia/Brunei",
      "Asia/Calcutta",
      "Asia/Katmandu",
      "Asia/Kuala_Lumpur",
      "Asia/Kuwait",
      "Asia/Muscat",
      "Asia/Phnom_Penh",
      "Asia/Rangoon",
      "Asia/Saigon",
      "Asia/Vientiane",
      "Atlantic/Faeroe",
      "Atlantic/Reykjavik",
      "Atlantic/St_Helena",
      "Europe/Amsterdam",
      "Europe/Bratislava",
      "Europe/Busingen",
      "Europe/Copenhagen",
      "Europe/Guernsey",
      "Europe/Isle_of_Man",
      "Europe/Jersey",
      "Europe/Kiev",
      "Europe/Ljubljana",
      "Europe/Luxembourg",
      "Europe/Mariehamn",
      "Europe/Monaco",
      "Europe/Oslo",
      "Europe/Podgorica",
      "Europe/San_Marino",
      "Europe/Sarajevo",
      "Europe/Skopje",
      "Europe/Stockholm",
      "Europe/Vaduz",
      "Europe/Vatican",
      "Europe/Zagreb",
      "Indian/Antananarivo",
      "Indian/Christmas",
      "Indian/Cocos",
      "Indian/Comoro",
      "Indian/Kerguelen",
      "Indian/Mahe",
      "Indian/Mayotte",
      "Indian/Reunion",
      "Pacific/Enderbury",
      "Pacific/Funafuti",
      "Pacific/Majuro",
      "Pacific/Midway",
      "Pacific/Ponape",
      "Pacific/Saipan",
      "Pacific/Truk",
      "Pacific/Wake",
      "Pacific/Wallis"
    ]
  },
  "entries": [
    {
      "ianaIdentifier": "Africa/Abidjan",
      "displayName": "Africa — Abidjan",
      "currentStdOffsetMinutes": 0,
      "currentDstOffsetMinutes": null,
      "currentStdAbbrev": "GMT",
      "currentDstAbbrev": null,
      "countryISO31661Alpha2Code": "CI",
      "coApplicableCountryISO31661Alpha2Codes": [
        "BF",
        "GH",
        "GM",
        "GN",
        "IS",
        "ML",
        "MR",
        "SH",
        "SL",
        "SN",
        "TG"
      ],
      "aliases": [
        "Africa/Accra",
        "Africa/Bamako",
        "Africa/Banjul",
        "Africa/Conakry",
        "Africa/Dakar",
        "Africa/Freetown",
        "Africa/Lome",
        "Africa/Nouakchott",
        "Africa/Ouagadougou",
        "Africa/Timbuktu",
        "Atlantic/Reykjavik",
        "Atlantic/St_Helena",
        "Iceland"
      ],
      "iso6709Coordinates": "+0519-00402",
      "comments": null
    },
    {
      "ianaIdentifier": "Africa/Algiers",
      "displayName": "Africa — Algiers",
      "currentStdOffsetMinutes": 60,
      "currentDstOffsetMinutes": null,
      "currentStdAbbrev": "GMT+1",
      "currentDstAbbrev": null,
      "countryISO31661Alpha2Code": "DZ",
      "coApplicableCountryISO31661Alpha2Codes": [],
      "aliases": [],
      "iso6709Coordinates": "+3647+00303",
      "comments": null
    },
    {
      "ianaIdentifier": "Africa/Bissau",
      "displayName": "Africa — Bissau",
      "currentStdOffsetMinutes": 0,
      "currentDstOffsetMinutes": null,
      "currentStdAbbrev": "GMT",
      "currentDstAbbrev": null,
      "countryISO31661Alpha2Code": "GW",
      "coApplicableCountryISO31661Alpha2Codes": [],
      "aliases": [],
      "iso6709Coordinates": "+1151-01535",
      "comments": null
    },
    {
      "ianaIdentifier": "Africa/Cairo",
      "displayName": "Africa — Cairo",
      "currentStdOffsetMinutes": 120,
      "currentDstOffsetMinutes": 180,
      "currentStdAbbrev": "GMT+2",
      "currentDstAbbrev": "GMT+3",
      "countryISO31661Alpha2Code": "EG",
      "coApplicableCountryISO31661Alpha2Codes": [],
      "aliases": ["Egypt"],
      "iso6709Coordinates": "+3003+03115",
      "comments": null
    },
    {
      "ianaIdentifier": "Africa/Casablanca",
      "displayName": "Africa — Casablanca",
      "currentStdOffsetMinutes": 60,
      "currentDstOffsetMinutes": null,
      "currentStdAbbrev": "GMT+1",
      "currentDstAbbrev": null,
      "countryISO31661Alpha2Code": "MA",
      "coApplicableCountryISO31661Alpha2Codes": [],
      "aliases": [],
      "iso6709Coordinates": "+3339-00735",
      "comments": null
    },
    {
      "ianaIdentifier": "Africa/Ceuta",
      "displayName": "Africa — Ceuta",
      "currentStdOffsetMinutes": 60,
      "currentDstOffsetMinutes": 120,
      "currentStdAbbrev": "GMT+1",
      "currentDstAbbrev": "GMT+2",
      "countryISO31661Alpha2Code": "ES",
      "coApplicableCountryISO31661Alpha2Codes": [],
      "aliases": [],
      "iso6709Coordinates": "+3553-00519",
      "comments": "Ceuta, Melilla"
    },
    {
      "ianaIdentifier": "Africa/El_Aaiun",
      "displayName": "Africa — El Aaiun",
      "currentStdOffsetMinutes": 60,
      "currentDstOffsetMinutes": null,
      "currentStdAbbrev": "GMT+1",
      "currentDstAbbrev": null,
      "countryISO31661Alpha2Code": "EH",
      "coApplicableCountryISO31661Alpha2Codes": [],
      "aliases": [],
      "iso6709Coordinates": "+2709-01312",
      "comments": null
    },
    {
      "ianaIdentifier": "Africa/Johannesburg",
      "displayName": "Africa — Johannesburg",
      "currentStdOffsetMinutes": 120,
      "currentDstOffsetMinutes": null,
      "currentStdAbbrev": "GMT+2",
      "currentDstAbbrev": null,
      "countryISO31661Alpha2Code": "ZA",
      "coApplicableCountryISO31661Alpha2Codes": ["LS", "SZ"],
      "aliases": ["Africa/Maseru", "Africa/Mbabane"],
      "iso6709Coordinates": "-2615+02800",
      "comments": null
    },
    {
      "ianaIdentifier": "Africa/Juba",
      "displayName": "Africa — Juba",
      "currentStdOffsetMinutes": 120,
      "currentDstOffsetMinutes": null,